[
    {
        "calendar_id": "romamo_it",
        "path": "jsondata\/sourcedata\/calendars\/dioceses\/IT\/romamo_it\/Diocesi di Roma.json",
        "nation": "IT",
        "diocese": "Diocesi di Roma",
        "group": "Diocesi del Lazio"
    },
    {
        "calendar_id": "boston_us",
        "path": "jsondata\/sourcedata\/calendars\/dioceses\/US\/boston_us\/Archdiocese of Boston (Massachusetts).json",
        "nation": "US",
        "diocese": "Archdiocese of Boston (Massachusetts)"
    },
    {
        "calendar_id": "socaap_it",
        "path": "jsondata\/sourcedata\/calendars\/dioceses\/IT\/socaap_it\/Diocesi di Sora - Cassino - Aquino - Pontecorvo.json",
        "nation": "IT",
        "diocese": "Diocesi di Sora - Cassino - Aquino - Pontecorvo",
        "group": "Diocesi del Lazio"
    },
    {
        "calendar_id": "roermo_nl",
        "path": "jsondata\/sourcedata\/calendars\/dioceses\/NL\/roermo_nl\/Roermond.json",
        "nation": "NL",
        "diocese": "Roermond"
    },
    {
        "calendar_id": "sherto_nl",
        "path": "jsondata\/sourcedata\/calendars\/dioceses\/NL\/sherto_nl\/'s-Hertogenbosch.json",
        "nation": "NL",
        "diocese": "'s-Hertogenbosch"
    },
    {
        "calendar_id": "utrech_nl",
        "path": "jsondata\/sourcedata\/calendars\/dioceses\/NL\/utrech_nl\/Utrecht.json",
        "nation": "NL",
        "diocese": "Utrecht"
    },
    {
        "calendar_id": "rotter_nl",
        "path": "jsondata\/sourcedata\/calendars\/dioceses\/NL\/rotter_nl\/Rotterdam.json",
        "nation": "NL",
        "diocese": "Rotterdam"
    },
    {
        "calendar_id": "grolee_nl",
        "path": "jsondata\/sourcedata\/calendars\/dioceses\/NL\/grolee_nl\/Groningen-Leeuwarden.json",
        "nation": "NL",
        "diocese": "Groningen-Leeuwarden"
    },
    {
        "calendar_id": "bredad_nl",
        "path": "jsondata\/sourcedata\/calendars\/dioceses\/NL\/bredad_nl\/Breda.json",
        "nation": "NL",
        "diocese": "Breda"
    },
    {
        "calendar_id": "haaams_nl",
        "path": "jsondata\/sourcedata\/calendars\/dioceses\/NL\/haaams_nl\/Haarlem-Amsterdam.json",
        "nation": "NL",
        "diocese": "Haarlem-Amsterdam"
    }
]
